MCQ,Choices,Correct
Who coined the term 'machine learning' in 1959?,a: Donald Hebb | b: Raytheon Company | c: Arthur Samuel | d: Tom M. Mitchell,c
What was the name of the experimental 'learning machine' developed by Raytheon Company in the early 1960s?,a: Cybertron | b: HAL 9000 | c: Deep Blue | d: Watson,a
Who proposed the early mathematical models of neural networks to come up with algorithms that mirror human thought processes?,a: Warren McCulloch | b: Tom M. Mitchell | c: Walter Pitts | d: Donald Hebb,a
What is the main objective of modern-day machine learning?,a: To create complex computer games | b: To predict future outcomes based on models | c: To study human cognitive processes | d: To analyze sonar signals,b
"According to Tom M. Mitchell, what is the definition of a computer program learning from experience?",a: Improving performance with experience | b: Storing data for future use | c: Analyzing historical events | d: Predicting future trends,a
